{
  "$schema": "http://json-schema.org/draft-07/schema#",
  "lessonId": "L1-SARC-001",
  "lessonNumber": 1,
  "lessonName": "Sarcasm Level 1: The Basics of Exaggeration",
  "pages": [
    {
      "pageType": "definition",
      "pageOrder": 0,
      "term": "Exaggerated Sarcasm",
      "definition": "A form of communication where a speaker says the exact opposite of what they mean, using heavy exaggeration to make the discrepancy obvious. In a shared social context, it often serves to bond over a shared frustration or absurdity.",
      "visualCues": [
        "Eye rolling or wide eyes",
        "Smirking or crooked smile",
        "Slow nodding while looking away",
        "Exaggerated hand gestures (like air quotes)"
      ],
      "toneCues": [
        "Elongated vowels (drawling)",
        "Heavy stress on adjectives (e.g., 'Greaaat')",
        "Lowered pitch compared to normal speech",
        "Nasal quality"
      ]
    },
    {
      "pageType": "practice",
      "pageOrder": 1,
      "scenario": {
        "context": "You and a friend are hiking. It has been uphill for three hours, you are both exhausted, sweating, and covered in mud.",
        "description": "Your friend stops, wipes sweat from their forehead, and gestures to the steep, muddy path ahead."
      },
      "audioSample": {
        "url": "",
        "duration": 5.5,
        "tonalPrompt": "Pantingly, with a heavy, dragged-out drawl on 'love' and 'relaxing'."
      },
      "transcript": "Oh, I just love this. Truly. There is nothing I enjoy more than cardio in the mud. So relaxing.",
      "appropriateResponse": {
        "description": "Respond with shared sarcasm to validate the misery of the hike.",
        "keyElements": [
          "Use a mocking or exaggerated tone",
          "Agree with the opposite of reality (e.g., 'Best spa day ever')",
          "Do not offer genuine encouragement like 'We can do it!'"
        ]
      }
    },
    {
      "pageType": "practice",
      "pageOrder": 2,
      "scenario": {
        "context": "You and your roommate are looking at a DIY bookshelf you just built. It is leaning dangerously to the left and looks like it will collapse if a feather touches it.",
        "description": "Your roommate crosses their arms and tilts their head, observing the disaster."
      },
      "audioSample": {
        "url": "",
        "duration": 4.0,
        "tonalPrompt": "High pitched, feigned amazement, heavy emphasis on 'masterpiece'."
      },
      "transcript": "Wow. Look at that craftsmanship. It's a structural masterpiece. Engineering schools should study this.",
      "appropriateResponse": {
        "description": "Join in the banter about how bad the construction is.",
        "keyElements": [
          "Laugh or smirk",
          "Add to the joke (e.g., 'It's modern art')",
          "Match the feigned admiration tone"
        ]
      }
    },
    {
      "pageType": "practice",
      "pageOrder": 3,
      "scenario": {
        "context": "You are stuck in gridlock traffic with a coworker. The cars haven't moved an inch in twenty minutes.",
        "description": "The coworker taps the steering wheel impatiently while looking at the sea of red brake lights."
      },
      "audioSample": {
        "url": "",
        "duration": 6.2,
        "tonalPrompt": "Flat, deadpan monotone with exaggerated slowness."
      },
      "transcript": "Slow down, everyone. Please. We are moving way too fast. I can't handle this kind of speed.",
      "appropriateResponse": {
        "description": "Reciprocate the frustration regarding the traffic using irony.",
        "keyElements": [
          "Maintain the deadpan or annoyed tone",
          "Comment on the 'danger' of the 'speed'",
          "Avoid literal interpretations of the request to slow down"
        ]
      }
    }
  ]
}