{
  "lessonId": "lesson_sarcasm_001",
  "lessonNumber": 1,
  "lessonName": "Sarcasm",
  "pages": [
    {
      "pageType": "definition",
      "pageOrder": 0,
      "term": "Sarcasm",
      "definition": "A form of irony used to mock or convey contempt, where the speaker says the opposite of what they actually mean. In beginner scenarios, the tone is often exaggerated to ensure the humor is understood.",
      "visualCues": [
        "Rolling eyes",
        "One-sided smirk",
        "Exaggerated blinking",
        "Deadpan facial expression"
      ],
      "toneCues": [
        "Elongated vowels (e.g., 'Greaaaaat')",
        "Lower pitch than normal speech",
        "Heavy emphasis on specific words",
        "Nasal quality"
      ]
    },
    {
      "pageType": "practice",
      "pageOrder": 1,
      "scenario": {
        "context": "Standing outside in a torrential downpour without an umbrella.",
        "description": "Your friend gestures broadly at the gray sky and the soaking wet ground."
      },
      "audioSample": {
        "url": "/audio/lesson_sarcasm_001_1_1768690637274.mp3",
        "duration": 5.15,
        "tonalPrompt": "Voice should be dripping with exaggerated enthusiasm that clearly contradicts the miserable reality.",
        "toneTag": "[Exaggeratedly Sarcastic]"
      },
      "transcript": "Oh, absolutely lovely weather we're having! Just perfect for a beach day, isn't it?",
      "appropriateResponse": {
        "description": "Acknowledge the shared misery with reciprocal humor. Do not treat the statement as a fact.",
        "keyElements": [
          "Smirk or chuckle",
          "Sarcastic agreement (e.g., 'I forgot my sunscreen')",
          "Relaxed posture indicating you are in on the joke"
        ]
      }
    },
    {
      "pageType": "practice",
      "pageOrder": 2,
      "scenario": {
        "context": "Looking at a sink overflowing with dirty dishes.",
        "description": "Your roommate stares at the mess, which clearly looks terrible and smells bad."
      },
      "audioSample": {
        "url": "/audio/lesson_sarcasm_001_2_1768690639602.mp3",
        "duration": 6.19,
        "tonalPrompt": "Tone should be mock-impressed, as if critiquing a fine art piece.",
        "toneTag": "[Playfully Sarcastic]"
      },
      "transcript": "I really admire what you've done with the kitchen. This mountain of plates is a bold artistic choice.",
      "appropriateResponse": {
        "description": "Play along with the 'artistic' frame instead of just apologizing immediately.",
        "keyElements": [
          "Playful defensive tone",
          "Validation of the joke (e.g., 'It represents the struggle of man')",
          "Shared laughter"
        ]
      }
    },
    {
      "pageType": "practice",
      "pageOrder": 3,
      "scenario": {
        "context": "After carrying a heavy couch up four flights of stairs.",
        "description": "Your moving partner leans against the wall, sweating profusely and panting."
      },
      "audioSample": {
        "url": "/audio/lesson_sarcasm_001_3_1768690642187.mp3",
        "duration": 4.05,
        "tonalPrompt": "Voice is tired, flat, and slow to emphasize the physical exhaustion.",
        "toneTag": "[Dry Sarcasm]"
      },
      "transcript": "You know, I was just thinking this was too easy. We should go back down and do it again.",
      "appropriateResponse": {
        "description": "Validate the exhaustion by agreeing with the absurd suggestion sarcastically.",
        "keyElements": [
          "Exaggerated nod",
          "Dry agreement (e.g., 'Absolutely, I barely broke a sweat')",
          "Eye roll at the situation"
        ]
      }
    }
  ]
}